{
  "states": [
    "boot",
    "loading",
    "ready",
    "round_requested",
    "outcome_received",
    "outcome_committed",
    "presenting_initial_result",
    "presenting_wins",
    "presenting_cascades",
    "feature_pending",
    "feature_entry",
    "feature_active",
    "super_feature_entry",
    "super_feature_active",
    "ultimate_feature_entry",
    "ultimate_feature_active",
    "feature_retrigger",
    "maximum_win",
    "feature_summary",
    "round_complete",
    "reconnecting",
    "recovering",
    "error"
  ],
  "transitions": [
    { "from": "boot", "to": "loading", "event": "boot_complete", "guards": [] },
    { "from": "loading", "to": "ready", "event": "assets_loaded", "guards": [] },
    { "from": "ready", "to": "round_requested", "event": "spin_requested", "guards": [] },
    { "from": "ready", "to": "reconnecting", "event": "connection_lost", "guards": [] },
    { "from": "round_requested", "to": "outcome_received", "event": "outcome_delivered", "guards": [] },
    { "from": "round_requested", "to": "error", "event": "request_failed", "guards": [] },
    { "from": "outcome_received", "to": "outcome_committed", "event": "commit_ack", "guards": [] },
    { "from": "outcome_committed", "to": "presenting_initial_result", "event": "presentation_start", "guards": [] },
    { "from": "presenting_initial_result", "to": "presenting_wins", "event": "initial_presented", "guards": ["has_wins"] },
    { "from": "presenting_initial_result", "to": "presenting_cascades", "event": "initial_presented", "guards": ["has_cascade_step"] },
    { "from": "presenting_initial_result", "to": "feature_pending", "event": "initial_presented", "guards": ["has_feature_trigger", "no_pending_win_steps"] },
    { "from": "presenting_initial_result", "to": "round_complete", "event": "initial_presented", "guards": ["no_wins_no_feature"] },
    { "from": "presenting_wins", "to": "presenting_cascades", "event": "wins_presented", "guards": ["has_cascade_step"] },
    { "from": "presenting_wins", "to": "feature_pending", "event": "wins_presented", "guards": ["has_feature_trigger"] },
    { "from": "presenting_wins", "to": "maximum_win", "event": "wins_presented", "guards": ["max_win_reached"] },
    { "from": "presenting_wins", "to": "round_complete", "event": "wins_presented", "guards": ["no_further_steps"] },
    { "from": "presenting_cascades", "to": "presenting_wins", "event": "cascade_presented", "guards": ["has_new_wins"] },
    { "from": "presenting_cascades", "to": "feature_pending", "event": "cascade_presented", "guards": ["never_cascaded_scatter_trigger"] },
    { "from": "presenting_cascades", "to": "round_complete", "event": "cascade_presented", "guards": ["no_further_steps"] },
    { "from": "feature_pending", "to": "feature_entry", "event": "feature_confirmed", "guards": ["scatters_eq_3"] },
    { "from": "feature_pending", "to": "super_feature_entry", "event": "feature_confirmed", "guards": ["scatters_eq_4"] },
    { "from": "feature_pending", "to": "ultimate_feature_entry", "event": "feature_confirmed", "guards": ["scatters_ge_5"] },
    { "from": "feature_entry", "to": "feature_active", "event": "entry_presented", "guards": [] },
    { "from": "super_feature_entry", "to": "super_feature_active", "event": "entry_presented", "guards": [] },
    { "from": "ultimate_feature_entry", "to": "ultimate_feature_active", "event": "entry_presented", "guards": [] },
    { "from": "feature_active", "to": "feature_retrigger", "event": "retrigger_awarded", "guards": ["retrigger_available"] },
    { "from": "super_feature_active", "to": "feature_retrigger", "event": "retrigger_awarded", "guards": ["retrigger_available"] },
    { "from": "ultimate_feature_active", "to": "feature_retrigger", "event": "retrigger_awarded", "guards": ["retrigger_available"] },
    { "from": "feature_retrigger", "to": "feature_active", "event": "retrigger_presented", "guards": ["tier_is_feature"] },
    { "from": "feature_retrigger", "to": "super_feature_active", "event": "retrigger_presented", "guards": ["tier_is_super_feature"] },
    { "from": "feature_retrigger", "to": "ultimate_feature_active", "event": "retrigger_presented", "guards": ["tier_is_ultimate_feature"] },
    { "from": "feature_active", "to": "maximum_win", "event": "cap_reached", "guards": ["max_win_reached"] },
    { "from": "super_feature_active", "to": "maximum_win", "event": "cap_reached", "guards": ["max_win_reached"] },
    { "from": "ultimate_feature_active", "to": "maximum_win", "event": "cap_reached", "guards": ["max_win_reached"] },
    { "from": "feature_active", "to": "feature_summary", "event": "rounds_exhausted", "guards": ["no_rounds_left"] },
    { "from": "super_feature_active", "to": "feature_summary", "event": "rounds_exhausted", "guards": ["no_rounds_left"] },
    { "from": "ultimate_feature_active", "to": "feature_summary", "event": "rounds_exhausted", "guards": ["no_rounds_left"] },
    { "from": "maximum_win", "to": "feature_summary", "event": "maxwin_presented", "guards": [] },
    { "from": "feature_summary", "to": "round_complete", "event": "summary_dismissed", "guards": [] },
    { "from": "round_complete", "to": "ready", "event": "settlement_confirmed", "guards": ["round_settled"] },
    { "from": "reconnecting", "to": "recovering", "event": "session_restored", "guards": [] },
    { "from": "reconnecting", "to": "error", "event": "recovery_failed", "guards": [] },
    { "from": "recovering", "to": "presenting_initial_result", "event": "recovery_complete", "guards": ["resume_mid_presentation"] },
    { "from": "recovering", "to": "ready", "event": "recovery_complete", "guards": ["round_already_settled"] },
    { "from": "error", "to": "ready", "event": "retry", "guards": [] }
  ],
  "guards": [
    { "id": "has_wins", "description": "The committed manifest step being presented contains wins[] with total > 0." },
    { "id": "has_cascade_step", "description": "The next step in the committed manifest is of type cascade." },
    { "id": "has_feature_trigger", "description": "scatterCount >= 3 on the committed initial grid (initial-grid counting; cascaded scatters never count)." },
    { "id": "no_pending_win_steps", "description": "All win/cascade presentation steps of the paid spin have been presented; feature entry is the next manifest step." },
    { "id": "no_wins_no_feature", "description": "The committed manifest has no wins, no cascade steps and scatterCount < 3." },
    { "id": "no_further_steps", "description": "No unpresented steps remain in the committed manifest for this round segment." },
    { "id": "has_new_wins", "description": "The cascade refill produced a new win set in the next committed step." },
    { "id": "never_cascaded_scatter_trigger", "description": "ALWAYS FALSE by design: countingRule is initial-grid, so scatters landing during cascades can never trigger a feature. This transition is declared only to document the GDD section 19 edge explicitly; it can never fire." },
    { "id": "scatters_eq_3", "description": "Committed initial-grid scatterCount == 3." },
    { "id": "scatters_eq_4", "description": "Committed initial-grid scatterCount == 4." },
    { "id": "scatters_ge_5", "description": "Committed initial-grid scatterCount >= 5 (fiveOrMoreUsesUltimateTier)." },
    { "id": "retrigger_available", "description": "The committed feature_retrigger step exists: 3+ scatters on the feature spin's initial drop AND the tier's retrigger cap (3/4/5) not yet reached." },
    { "id": "tier_is_feature", "description": "Active tier in committed round state is feature." },
    { "id": "tier_is_super_feature", "description": "Active tier in committed round state is super_feature." },
    { "id": "tier_is_ultimate_feature", "description": "Active tier in committed round state is ultimate_feature." },
    { "id": "max_win_reached", "description": "Cumulative round win in the committed manifest equals maxWinXBet x bet (a max_win_termination step is present)." },
    { "id": "no_rounds_left", "description": "spinsLeft == 0 in the committed round state and no retrigger step follows." },
    { "id": "round_settled", "description": "Server acknowledged settlement of the round (balanceAfterMinor confirmed)." },
    { "id": "resume_mid_presentation", "description": "The re-fetched committed manifest carries a resumePointer into presentation/feature steps." },
    { "id": "round_already_settled", "description": "The re-fetched round is fully settled server-side; nothing to replay." }
  ],
  "actions": [
    { "id": "lock_spin_input", "description": "Disable spin/bet/buy controls and start the jurisdiction minimum-round-duration timer.", "onEntryOf": "round_requested" },
    { "id": "unlock_spin_input", "description": "Re-enable spin/bet controls; release-and-re-press required where the active policy demands it.", "onEntryOf": "ready" },
    { "id": "verify_manifest_signature", "description": "Verify the outcome manifest signature before commit; failure routes to error.", "onEntryOf": "outcome_received" },
    { "id": "persist_resume_pointer", "description": "Persist the committed manifest id and resumePointer so any interruption replays from committed data.", "onEntryOf": "outcome_committed" },
    { "id": "stop_autoplay_on_trigger", "description": "Stop any active autoplay session (tier trigger is a mandatory stop condition).", "onEntryOf": "feature_pending" },
    { "id": "show_feature_hud", "description": "Show master-vial (bank) display and spins-left counter for The Tasting.", "onEntryOf": "feature_entry" },
    { "id": "show_super_feature_hud", "description": "Show master-vial display, spins-left counter and distillery pressure dial for The Distillery.", "onEntryOf": "super_feature_entry" },
    { "id": "show_ultimate_feature_hud", "description": "Show master-vial display, spins-left counter and prism rail for The Night Garden.", "onEntryOf": "ultimate_feature_entry" },